[
  {
    "event_id": "subj-farm-01",
    "event_type": "SUBJECT_REGISTERED",
    "aggregate_type": "food_business",
    "aggregate_id": "bz-farm-01",
    "occurred_at": "2026-10-03T08:00:00+08:00",
    "recorded_at": "2026-10-03T08:00:00+08:00",
    "version": 1,
    "source_department": "agriculture",
    "summary": "青山蔬菜种植合作社登记",
    "payload": {
      "business_name": "青山蔬菜种植合作社",
      "business_type": "producer",
      "department": "agriculture"
    }
  },
  {
    "event_id": "subj-wholesale-01",
    "event_type": "SUBJECT_REGISTERED",
    "aggregate_type": "food_business",
    "aggregate_id": "bz-wholesale-01",
    "occurred_at": "2026-10-03T08:10:00+08:00",
    "recorded_at": "2026-10-03T08:10:00+08:00",
    "version": 1,
    "source_department": "market_regulation",
    "summary": "旺发蔬菜行登记",
    "payload": {
      "business_name": "旺发蔬菜行",
      "business_type": "wholesaler",
      "department": "market_regulation"
    }
  },
  {
    "event_id": "subj-distributor-01",
    "event_type": "SUBJECT_REGISTERED",
    "aggregate_type": "food_business",
    "aggregate_id": "bz-distributor-01",
    "occurred_at": "2026-10-03T08:20:00+08:00",
    "recorded_at": "2026-10-03T08:20:00+08:00",
    "version": 1,
    "source_department": "market_regulation",
    "summary": "鲜达配送公司登记",
    "payload": {
      "business_name": "鲜达配送有限公司",
      "business_type": "distributor",
      "department": "market_regulation"
    }
  },
  {
    "event_id": "subj-restaurant-01",
    "event_type": "SUBJECT_REGISTERED",
    "aggregate_type": "food_business",
    "aggregate_id": "bz-restaurant-group-01",
    "occurred_at": "2026-10-03T08:30:00+08:00",
    "recorded_at": "2026-10-03T08:30:00+08:00",
    "version": 1,
    "source_department": "market_regulation",
    "summary": "悦味餐饮管理有限公司登记",
    "payload": {
      "business_name": "悦味餐饮管理有限公司",
      "business_type": "catering",
      "department": "market_regulation"
    }
  },
  {
    "event_id": "subj-restaurant-02",
    "event_type": "SUBJECT_REGISTERED",
    "aggregate_type": "food_business",
    "aggregate_id": "bz-restaurant-group-02",
    "occurred_at": "2026-10-03T08:31:00+08:00",
    "recorded_at": "2026-10-03T08:31:00+08:00",
    "version": 1,
    "source_department": "market_regulation",
    "summary": "悦味餐饮第二分店主体登记",
    "payload": {
      "business_name": "悦味餐饮（城南）分店",
      "business_type": "catering",
      "department": "market_regulation"
    }
  },
  {
    "event_id": "bo-restaurant-01",
    "event_type": "BENEFICIAL_OWNER_DECLARED",
    "aggregate_type": "food_business",
    "aggregate_id": "bz-restaurant-group-01",
    "occurred_at": "2026-10-03T08:40:00+08:00",
    "recorded_at": "2026-10-03T08:40:00+08:00",
    "version": 2,
    "source_department": "market_regulation",
    "summary": "受益人声明：厉强",
    "payload": {
      "owner_name": "厉强",
      "owner_id_no": "3301**********1234",
      "declared_at": "2026-10-03T08:40:00+08:00"
    }
  },
  {
    "event_id": "bo-restaurant-02",
    "event_type": "BENEFICIAL_OWNER_DECLARED",
    "aggregate_type": "food_business",
    "aggregate_id": "bz-restaurant-group-02",
    "occurred_at": "2026-10-03T08:41:00+08:00",
    "recorded_at": "2026-10-03T08:41:00+08:00",
    "version": 2,
    "source_department": "market_regulation",
    "summary": "受益人声明：厉强",
    "payload": {
      "owner_name": "厉强",
      "owner_id_no": "3301**********1234",
      "declared_at": "2026-10-03T08:41:00+08:00"
    }
  },
  {
    "event_id": "lic-pr-wholesale",
    "event_type": "PREMISES_LICENSED",
    "aggregate_type": "premises",
    "aggregate_id": "pr-wholesale-01",
    "occurred_at": "2026-10-03T09:00:00+08:00",
    "recorded_at": "2026-10-03T09:00:00+08:00",
    "version": 1,
    "source_department": "market_regulation",
    "summary": "批发市场摊位食品经营许可签发",
    "payload": {
      "premises_id": "pr-wholesale-01",
      "business_id": "bz-wholesale-01",
      "address": "城南批发市场B区17号",
      "license_no": "JY12026100301",
      "scope": "食用农产品销售"
    }
  },
  {
    "event_id": "ver-pr-wholesale",
    "event_type": "PREMISES_VERIFIED",
    "aggregate_type": "premises",
    "aggregate_id": "pr-wholesale-01",
    "occurred_at": "2026-10-03T10:00:00+08:00",
    "recorded_at": "2026-10-03T10:00:00+08:00",
    "version": 2,
    "source_department": "market_regulation",
    "summary": "实地核查：批发市场摊位属实",
    "payload": {
      "premises_id": "pr-wholesale-01",
      "result": "pass",
      "verifier_department": "market_regulation",
      "checked_at": "2026-10-03T10:00:00+08:00"
    }
  },
  {
    "event_id": "lic-pr-kitchen",
    "event_type": "PREMISES_LICENSED",
    "aggregate_type": "premises",
    "aggregate_id": "pr-kitchen-01",
    "occurred_at": "2026-10-03T09:05:00+08:00",
    "recorded_at": "2026-10-03T09:05:00+08:00",
    "version": 1,
    "source_department": "market_regulation",
    "summary": "餐饮经营许可签发",
    "payload": {
      "premises_id": "pr-kitchen-01",
      "business_id": "bz-restaurant-group-01",
      "address": "城南街道兴华路9号101室",
      "license_no": "JY12026200807",
      "scope": "热食类食品制售"
    }
  },
  {
    "event_id": "ver-pr-kitchen",
    "event_type": "PREMISES_VERIFIED",
    "aggregate_type": "premises",
    "aggregate_id": "pr-kitchen-01",
    "occurred_at": "2026-10-03T10:30:00+08:00",
    "recorded_at": "2026-10-03T10:30:00+08:00",
    "version": 2,
    "source_department": "market_regulation",
    "summary": "实地核查：该地址为居民住宅，无实际经营门店",
    "payload": {
      "premises_id": "pr-kitchen-01",
      "result": "no_physical_store",
      "verifier_department": "market_regulation",
      "checked_at": "2026-10-03T10:30:00+08:00"
    }
  },
  {
    "event_id": "shop-weipin-01",
    "event_type": "PLATFORM_SHOP_LISTED",
    "aggregate_type": "platform_shop",
    "aggregate_id": "shop-weipin-01",
    "occurred_at": "2026-10-03T11:00:00+08:00",
    "recorded_at": "2026-10-03T11:00:00+08:00",
    "version": 1,
    "source_department": "platform",
    "summary": "味拼外卖店铺“悦味轻食”上线",
    "payload": {
      "platform": "味拼外卖",
      "shop_name": "悦味轻食（兴华路店）",
      "business_id": "bz-restaurant-group-01",
      "claimed_premises_id": "pr-kitchen-01"
    }
  },
  {
    "event_id": "shop-weipin-01-verify",
    "event_type": "DELIVERY_PLATFORM_VERIFIED",
    "aggregate_type": "platform_shop",
    "aggregate_id": "shop-weipin-01",
    "occurred_at": "2026-10-03T11:05:00+08:00",
    "recorded_at": "2026-10-03T11:05:00+08:00",
    "version": 2,
    "source_department": "platform",
    "summary": "外卖平台自检显示通过",
    "payload": {
      "platform": "味拼外卖",
      "result": "pass",
      "verified_at": "2026-10-03T11:05:00+08:00"
    }
  },
  {
    "event_id": "lot-veg-01-reg",
    "event_type": "LOT_REGISTERED",
    "aggregate_type": "food_lot",
    "aggregate_id": "lot-veg-01",
    "occurred_at": "2026-10-03T12:00:00+08:00",
    "recorded_at": "2026-10-03T12:00:00+08:00",
    "version": 1,
    "source_department": "agriculture",
    "summary": "产地批次：大白菜1000公斤",
    "payload": {
      "product_name": "大白菜",
      "producer_business_id": "bz-farm-01",
      "quantity": 1000,
      "unit": "kg"
    }
  },
  {
    "event_id": "lot-veg-01-transit",
    "event_type": "LOT_TRANSFERRED",
    "aggregate_type": "food_lot",
    "aggregate_id": "lot-veg-01",
    "occurred_at": "2026-10-03T13:00:00+08:00",
    "recorded_at": "2026-10-03T13:00:00+08:00",
    "version": 2,
    "source_department": "agriculture",
    "summary": "产地发运，在途",
    "payload": {
      "from_holder_id": "bz-farm-01",
      "to_holder_id": "bz-wholesale-01",
      "quantity": 1000,
      "unit": "kg",
      "handover_status": "in_transit"
    }
  },
  {
    "event_id": "lot-veg-01-received",
    "event_type": "LOT_TRANSFERRED",
    "aggregate_type": "food_lot",
    "aggregate_id": "lot-veg-01",
    "occurred_at": "2026-10-03T16:00:00+08:00",
    "recorded_at": "2026-10-03T16:00:00+08:00",
    "version": 3,
    "source_department": "agriculture",
    "summary": "批发市场签收",
    "payload": {
      "from_holder_id": "bz-farm-01",
      "to_holder_id": "bz-wholesale-01",
      "quantity": 1000,
      "unit": "kg",
      "handover_status": "received"
    }
  },
  {
    "event_id": "lot-veg-01p-relabel",
    "event_type": "LOT_RELABELED",
    "aggregate_type": "food_lot",
    "aggregate_id": "lot-veg-01p",
    "occurred_at": "2026-10-03T16:30:00+08:00",
    "recorded_at": "2026-10-03T16:30:00+08:00",
    "version": 1,
    "source_department": "market_regulation",
    "summary": "批发市场更换为“绿色基地直供”包装",
    "payload": {
      "source_lot_ids": [
        "lot-veg-01"
      ],
      "new_package_label": "绿色基地直供大白菜",
      "operator_business_id": "bz-wholesale-01",
      "location": "城南批发市场B区17号",
      "quantity": 1000,
      "unit": "kg"
    }
  },
  {
    "event_id": "lot-veg-01p-a-split",
    "event_type": "LOT_SPLIT",
    "aggregate_type": "food_lot",
    "aggregate_id": "lot-veg-01p-a",
    "occurred_at": "2026-10-03T17:00:00+08:00",
    "recorded_at": "2026-10-03T17:00:00+08:00",
    "version": 1,
    "source_department": "market_regulation",
    "summary": "拆出300公斤供配送",
    "payload": {
      "parent_lot_id": "lot-veg-01p",
      "quantity": 300,
      "unit": "kg"
    }
  },
  {
    "event_id": "lot-veg-01p-b-split",
    "event_type": "LOT_SPLIT",
    "aggregate_type": "food_lot",
    "aggregate_id": "lot-veg-01p-b",
    "occurred_at": "2026-10-03T17:05:00+08:00",
    "recorded_at": "2026-10-03T17:05:00+08:00",
    "version": 1,
    "source_department": "market_regulation",
    "summary": "剩余700公斤留档批发",
    "payload": {
      "parent_lot_id": "lot-veg-01p",
      "quantity": 700,
      "unit": "kg"
    }
  },
  {
    "event_id": "lot-a-cold",
    "event_type": "COLD_CHAIN_HANDOVER",
    "aggregate_type": "food_lot",
    "aggregate_id": "lot-veg-01p-a",
    "occurred_at": "2026-10-03T17:30:00+08:00",
    "recorded_at": "2026-10-03T17:30:00+08:00",
    "version": 2,
    "source_department": "market_regulation",
    "summary": "冷链装车交接",
    "payload": {
      "transport_leg_id": "leg-20261003-07",